Product Link,Breadcrumb(Category),Category,Product Name,Pricing,Available Size,Sense Size,Image URL,Description Title,Description,Description(Itemization),Special Function,Rating,Number of Reviews,Recommendation Rate,Fitting Rating,Length Rating,Material Rating,Comfort Rating,KWs
https://shop.adidas.jp/products/IR8001/,戻る / トップ / メンズ / ウェア・服 / トップス / Tシャツ / オリジナルス / アディカラー / アディカラー トレフォイル 半袖Tシャツ,メンズオリジナルス,アディカラー トレフォイル 半袖Tシャツ,"8,360","XS, S, M, L, XL, 2XL, 3XL",,"['https://shop.adidas.jp/photo/IR/IR8001/z-IR8001-on_model-standard_view-V6R2YYO3St.jpg', 'https://shop.adidas.jp/photo/IR/IR8001/z-IR8001-on_model-back_view-BtFeZEvVfu.jpg', 'https://shop.adidas.jp/photo/IR/IR8001/z-IR8001-on_model-walking_view-aMsM4QoXaU.jpg', 'https://shop.adidas.jp/photo/IR/IR8001/z-IR8001-3d_torso-front_center_view-FZiienCEiC.jpg', 'https://shop.adidas.jp/photo/IR/IR8001/z-IR8001-on_model-detail_view_1-wklmg83h3X.jpg', 'https://shop.adidas.jp/photo/IR/IR8001/z-IR8001-on_model-detail_view_2-WR3ww7CK3w.jpg']",トレフォイルスタイルのタイムレスなTシャツ。,"生まれ変わったクラシックアイテム。このアディダスTシャツは、カジュアルスタイルにコンテンポラリーなひねりを加えてアップデート。正面に、スポーツブランドの証しとなるアイコニックなトレフォイルロゴをスクリーンプリントしている。デイリーウェアにぴったりな、ソフトなコットン素材を用いたクラシックなフィット感のエフォートレスなルックスだから、どんなコーディネートにも欠かせない。

この製品に使われているコットンは、ベターコットンを通して供給されている。ベターコットンの調達は、「マスバランス」と呼ばれる生産物流管理モデルを通しており、最終製品までの過程を物理的に辿れるわけではない。

詳細はこちら：https://bettercotton.org/who-we-are/our-logo/","レギュラーフィット
リブ仕上げのクルーネック
綿100%（シングルジャージー）
素材は、ベターコットンを通して、マスバランスと呼ばれるシステム経由で調達しているため、この製品には実際にベターコットンが使用されていない可能性があります。
商品番号：IR8001
色：バイオレットトーン",[],4,1,100%,3 / 5,3 / 5,4 / 5,5 / 5,"ウェア・服, トップス, Tシャツ, オリジナルス, アディカラー, 半袖, ベターコットン, KMB09"
https://shop.adidas.jp/products/IZ4918/,戻る / トップ / メンズ / ウェア・服 / アウター / ジャケット / オリジナルス / ORDINARY PEOPLE x ジャケット,メンズオリジナルス,ORDINARY PEOPLE X ジャケット,"18,700","XS, S, M, L, XL, 2XL, 3XL",,"['https://shop.adidas.jp/photo/IZ/IZ4918/z-IZ4918-on_model-standard_view-9rTqM1emDt.jpg', 'https://shop.adidas.jp/photo/IZ/IZ4918/z-IZ4918-on_model-back_view-mz9gOXoyOD.jpg', 'https://shop.adidas.jp/photo/IZ/IZ4918/z-IZ4918-on_model-walking_view-lzSl6HRPGT.jpg', 'https://shop.adidas.jp/photo/IZ/IZ4918/z-IZ4918-3d_torso-front_center_view-SFaPTvCX3I.jpg', 'https://shop.adidas.jp/photo/IZ/IZ4918/z-IZ4918-on_model-detail_view_1-F67RvkHYK6.jpg', 'https://shop.adidas.jp/photo/IZ/IZ4918/z-IZ4918-on_model-detail_view_2-dORUNTFKHu.jpg']",韓国ブランド「ORDINARY PEOPLE」とのコラボレートコレクションが登場。,"さりげないのに斬新。過去の名作に倣ったデザインを、新たな領域に押し上げた。アシンメトリーなディテールと、新たな視点で再解釈したアディダスのスリーストライプスが特徴の、Ordinary Peopleとのコラボレーションアイテム。小さなトレフォイルロゴが、これまで世界を変えてきたアスリート、クリエイター、ゲームチェンジャーたちの数十年の歴史を感じさせる。

この製品にはリサイクル素材を100%使用。製造された製品の素材をリユースすることで、ゴミの量、限りある資源への依存、そしてアディダス製品のフットプリントを減らすことにつながる。","ルーズフィット
フロントにややカーブをつけた2WAYフルジップ / スタンドカラー
ナイロン100％（プレーンウィーブ）
両サイドにポケット
伸縮性のある袖口と裾
袖のジップを開けるとストライプが覗くデザイン
商品番号：IZ4918
色：オニックス
生産国：China",[],,,,,,,,"ウェア・服, アウター, ジャケット, オリジナルス, リサイクル素材一部使用, JMN69"
https://shop.adidas.jp/products/IR7110/,戻る / トップ / メンズ / ウェア・服 / トップス / ポロシャツ / Y-3 / Y-3 SHORT SLEEVE POLO SHIRT,メンズY-3,Y-3 SHORT SLEEVE POLO SHIRT,"29,150","2XS, XS, S, M, L, XL",,"['https://shop.adidas.jp/photo/IR/IR7110/z-IR7110-on_model-standard_view-g2R3wap3nY.jpg', 'https://shop.adidas.jp/photo/IR/IR7110/z-IR7110-on_model-side_view-trFnZeg3cm.jpg', 'https://shop.adidas.jp/photo/IR/IR7110/z-IR7110-on_model-back_view-1ZpDrLAJQM.jpg', 'https://shop.adidas.jp/photo/IR/IR7110/z-IR7110-on_model-walking_view-M52II5t6qF.jpg', 'https://shop.adidas.jp/photo/IR/IR7110/z-IR7110-flat-front_center_view-EF15yfMB8m.jpg', 'https://shop.adidas.jp/photo/IR/IR7110/z-IR7110-on_model-detail_view_1-qaQH9KDga9.jpg', 'https://shop.adidas.jp/photo/IR/IR7110/z-IR7110-on_model-detail_view_2-EU7jW8mVkx.jpg', 'https://shop.adidas.jp/photo/IR/IR7110/z-IR7110-on_model-detail_view_3-boGPFwqXD7.jpg']",Y-3が贈る、クラシックなポロシャツ。,ワードローブに欠かせないこの「Y-3 SHORT SLEEVE POLO SHIRT」は、フォーマルとカジュアルのいいとこどりをしたデザイン。3つボタンのポロ襟を備え、サイドスリットの入ったドロップテールをあしらっている。素材にコットンピケを用いたウーブン生地は、独特の風合いが魅力。,"レギュラーフィット
3つボタンのポロ襟
綿100%（ピケ）
ドロップテールの裾にサイドスリット
商品番号：IR7110
色：ブラック",[],,,,,,,,"ウェア・服, トップス, ポロシャツ, Y-3, 半袖, JRT87"
https://shop.adidas.jp/products/IN2984/,戻る / トップ / メンズ / ランニング / ウェア・服 / アウター / ジャケット / Move for the Planet ジャケット,メンズランニング,MOVE FOR THE PLANET ジャケット,"15,400","XS, S, M, L, XL, 2XL, 3XL",,"['https://shop.adidas.jp/photo/IN/IN2984/z-IN2984-marketing-heromrktng_view_1-XYqXSAlc8D.jpg', 'https://shop.adidas.jp/photo/IN/IN2984/z-IN2984-on_model-standard_view-733pMHSSe5.jpg', 'https://shop.adidas.jp/photo/IN/IN2984/z-IN2984-marketing-heromrktng_view_3-UkYlMChlCo.jpg', 'https://shop.adidas.jp/photo/IN/IN2984/z-IN2984-marketing-heromrktng_view_4-9kyU0o9Irr.jpg', 'https://shop.adidas.jp/photo/IN/IN2984/z-IN2984-marketing-heromrktng_view_5-GUrZ8wxpGG.jpg', 'https://shop.adidas.jp/photo/IN/IN2984/z-IN2984-marketing-heromrktng_view_6-eeE5rJeJ12.jpg', 'https://shop.adidas.jp/photo/IN/IN2984/z-IN2984-marketing-heromrktng_view_7-PLi495CLmy.jpg', 'https://shop.adidas.jp/photo/IN/IN2984/z-IN2984-marketing-heromrktng_view_8-k3hPdAJaT7.jpg', 'https://shop.adidas.jp/static/images/tools/itemCard_dummy.jpg', 'https://shop.adidas.jp/static/images/tools/itemCard_dummy.jpg', 'https://shop.adidas.jp/static/images/tools/itemCard_dummy.jpg', 'https://shop.adidas.jp/static/images/tools/itemCard_dummy.jpg', 'https://shop.adidas.jp/static/images/tools/itemCard_dummy.jpg', 'https://shop.adidas.jp/static/images/tools/itemCard_dummy.jpg', 'https://shop.adidas.jp/static/images/tools/itemCard_dummy.jpg', 'https://shop.adidas.jp/static/images/tools/itemCard_dummy.jpg']",リサイクル素材を一部使用した、スタイリッシュなランニングジャケット。,"木々に囲まれたトレイルでも公園の小道でも、ランニングをするときはこのジャケットを着て、健全な地球環境を守るために声を上げよう。動きやすい身体にぴったりフィットするカッティングを採用したジャケットに、薄暗い場所でも光を反射させて視認性を高めるリフレクターを付けている。ジップポケットには、鍵、補給ゼリー、スマホなどを収納可能。

この製品には、リサイクル素材を70%以上使用。製造された製品の素材をリユースすることで、ゴミの量、限りある資源への依存、そしてアディダス製品のフットプリントを減らすことにつながる。

カーボンフットプリントを認識する：
製品のカーボンフットプリントの算定方法はライフサイクルの全ステージを考慮しており、アディダスのプロトタイプのサイズに基づいています。原料抽出から、加工、生産と製品組立、包装、輸送、使用、製品寿命に至るまでのカーボンフットプリント（CO2e）を算定しました。これは国際規格「ISO 14067」に基づいています。

製品カーボンフットプリント総量の内訳とその算定方法を確認するには、下記のリンクをコピーしてお使いのブラウザで検索してください。https://www.adidas.com/go/campaign/carbon-footprint","スリムフィット
フルジップ / スタンドカラー
ポリエステル97% / ポリウレタン3%（プレーンウィーブ）
胸にジップポケット
両サイドにジップポケット
リフレクター付き
商品番号：IN2984
色：プリラブドフィグ
生産国：Cambodia",[],,,,,,,,"ウェア・服, アウター, ジャケット, ランニング, リフレクター付き, ランニングウェア・服, IKM15"
https://shop.adidas.jp/products/IR8010/,戻る / トップ / メンズ / ウェア・服 / トップス / Tシャツ / オリジナルス / アディカラー / アディカラー トレフォイル 半袖Tシャツ,メンズオリジナルス,アディカラー トレフォイル 半袖Tシャツ,"3,850","XS, S, M, L, XL, 2XL, 3XL",,"['https://shop.adidas.jp/photo/IR/IR8010/z-IR8010-on_model-standard_view-wzceNIbJKd.jpg', 'https://shop.adidas.jp/photo/IR/IR8010/z-IR8010-on_model-back_view-ezzWubO0d1.jpg', 'https://shop.adidas.jp/photo/IR/IR8010/z-IR8010-on_model-walking_view-NFWcYWyJSe.jpg', 'https://shop.adidas.jp/photo/IR/IR8010/z-IR8010-3d_torso-front_center_view-cjBHZH90Zo.jpg', 'https://shop.adidas.jp/photo/IR/IR8010/z-IR8010-on_model-detail_view_1-Pca9XJV4Sc.jpg', 'https://shop.adidas.jp/photo/IR/IR8010/z-IR8010-on_model-detail_view_2-iP0aU41xUe.jpg']",トレフォイルスタイルのタイムレスなTシャツ。,"生まれ変わったクラシックアイテム。このアディダスTシャツは、カジュアルスタイルにコンテンポラリーなひねりを加えてアップデート。正面に、スポーツブランドの証しとなるアイコニックなトレフォイルロゴをスクリーンプリントしている。デイリーウェアにぴったりな、ソフトなコットン素材を用いたクラシックなフィット感のエフォートレスなルックスだから、どんなコーディネートにも欠かせない。

この製品に使われているコットンは、ベターコットンを通して供給されている。ベターコットンの調達は、「マスバランス」と呼ばれる生産物流管理モデルを通しており、最終製品までの過程を物理的に辿れるわけではない。

詳細はこちら：https://bettercotton.org/who-we-are/our-logo/","レギュラーフィット
リブ仕上げのクルーネック
綿100%（シングルジャージー）
素材は、ベターコットンを通して、マスバランスと呼ばれるシステム経由で調達しているため、この製品には実際にベターコットンが使用されていない可能性があります。
商品番号：IR8010
色：ブルーバード",[],4,1,100%,3 / 5,3 / 5,4 / 5,5 / 5,"ウェア・服, トップス, Tシャツ, オリジナルス, アディカラー, 半袖, ベターコットン, KMB09"
https://shop.adidas.jp/products/IZ4919/,戻る / トップ / メンズ / ウェア・服 / アウター / ジャケット / オリジナルス / ORDINARY PEOPLE x ジャケット,メンズオリジナルス,ORDINARY PEOPLE X ジャケット,"16,500","XS, S, M, L, XL, 2XL, 3XL",,"['https://shop.adidas.jp/photo/IZ/IZ4919/z-IZ4919-on_model-standard_view-p6NxBF4tzL.jpg', 'https://shop.adidas.jp/photo/IZ/IZ4919/z-IZ4919-on_model-back_view-YTXJl7Opgf.jpg', 'https://shop.adidas.jp/photo/IZ/IZ4919/z-IZ4919-on_model-walking_view-hUf2IH624V.jpg', 'https://shop.adidas.jp/photo/IZ/IZ4919/z-IZ4919-3d_torso-front_center_view-JXJ68zn5jq.jpg', 'https://shop.adidas.jp/photo/IZ/IZ4919/z-IZ4919-on_model-detail_view_1-KdaUqyZeqy.jpg', 'https://shop.adidas.jp/photo/IZ/IZ4919/z-IZ4919-on_model-detail_view_2-cAcp81Fhkd.jpg']",韓国ブランド「ORDINARY PEOPLE」とのコラボレートコレクションが登場。,"さりげないのに斬新。過去の名作に倣ったデザインを、新たな領域に押し上げた。アシンメトリーなディテールと、新たな視点で再解釈したアディダスのスリーストライプスが特徴の、Ordinary Peopleとのコラボレーションアイテム。小さなトレフォイルロゴが、これまで世界を変えてきたアスリート、クリエイター、ゲームチェンジャーたちの数十年の歴史を感じさせる。

この製品にはリサイクル素材を100%使用。製造された製品の素材をリユースすることで、ゴミの量、限りある資源への依存、そしてアディダス製品のフットプリントを減らすことにつながる。","ルーズフィット
フロントにややカーブをつけた2WAYフルジップ / スタンドカラー
ナイロン100％（プレーンウィーブ）
両サイドにポケット
伸縮性のある袖口と裾
袖のジップを開けるとストライプが覗くデザイン
商品番号：IZ4919
色：ルシッドシアン
生産国：China",[],,,,,,,,"ウェア・服, アウター, ジャケット, オリジナルス, リサイクル素材一部使用, JMN69"
https://shop.adidas.jp/products/IV5647/,戻る / トップ / メンズ / ウェア・服 / トップス / ポロシャツ / Y-3 / Y-3 SHORT SLEEVE POLO SHIRT,メンズY-3,Y-3 SHORT SLEEVE POLO SHIRT,"60,500","2XS, XS, S, M, L, XL",,"['https://shop.adidas.jp/photo/IV/IV5647/z-IV5647-on_model-standard_view-XAmQ4HMXzk.jpg', 'https://shop.adidas.jp/photo/IV/IV5647/z-IV5647-on_model-side_view-V52vCoo5OB.jpg', 'https://shop.adidas.jp/photo/IV/IV5647/z-IV5647-on_model-back_view-dyA0hbONdP.jpg', 'https://shop.adidas.jp/photo/IV/IV5647/z-IV5647-on_model-walking_view-kZ5LtvkleQ.jpg', 'https://shop.adidas.jp/photo/IV/IV5647/z-IV5647-flat-front_center_view-IGdQihiUkn.jpg', 'https://shop.adidas.jp/photo/IV/IV5647/z-IV5647-on_model-detail_view_1-7L4mFVjo5f.jpg', 'https://shop.adidas.jp/photo/IV/IV5647/z-IV5647-on_model-detail_view_2-HUJLJOB65p.jpg', 'https://shop.adidas.jp/photo/IV/IV5647/z-IV5647-on_model-detail_view_3-DQV4P87Kqf.jpg']",Y-3が贈る、クラシックなポロシャツ。,ワードローブに欠かせないこの「Y-3 SHORT SLEEVE POLO SHIRT」は、フォーマルとカジュアルのいいとこどりをしたデザイン。3つボタンのポロ襟を備え、サイドスリットの入ったドロップテールをあしらっている。素材にコットンピケを用いたウーブン生地は、独特の風合いが魅力。,"レギュラーフィット
3つボタンのポロ襟
綿100%（ピケ）
ドロップテールの裾にサイドスリット
商品番号：IV5647
色：オフホワイト",[],,,,,,,,"ウェア・服, トップス, ポロシャツ, Y-3, 半袖, JRT87"
https://shop.adidas.jp/products/IL3294/,戻る / トップ / メンズ / ウェア・服 / トップス / パーカー(フーディー) / スポーツウェア / エッセンシャルズ フリースパーカー,メンズスポーツウェア,エッセンシャルズ フリースパーカー,"3,457","S, M, L, O (XL)",,"['https://shop.adidas.jp/photo/IL/IL3294/z-IL3294-on_model-standard_view-6ZIPsJnMgj.jpg', 'https://shop.adidas.jp/photo/IL/IL3294/z-IL3294-on_model-back_view-1Fy81RPet6.jpg', 'https://shop.adidas.jp/photo/IL/IL3294/z-IL3294-on_model-walking_view-948MyDUz7D.jpg', 'https://shop.adidas.jp/photo/IL/IL3294/z-IL3294-3d_torso-front_center_view-wYA3WIewMe.jpg', 'https://shop.adidas.jp/photo/IL/IL3294/z-IL3294-on_model-detail_view_1-GBKWyhElDq.jpg', 'https://shop.adidas.jp/photo/IL/IL3294/z-IL3294-on_model-detail_view_2-PO3z9CwJQm.jpg']",ドローコードで調節可能なフードを備えたパーカー。,"大荒れの天気でもこれがあれば大丈夫。このフリースパーカーに袖を通せば、太陽が雲に覆われても快適な暖かさが持続。カンガルーポケットに手を入れれば、瞬時に暖かさを感じられる。

アディダスは「ベター・コットン・イニシアティブ」と提携し世界のコットン栽培環境の向上をサポート。この製品を着用して、持続可能な綿花栽培に貢献したい。この製品は、プラスチック廃棄物をゼロにする取り組みとして、一部にリサイクル素材を使用。","レギュラーフィット
ドローコードで調節可能なフード
綿70% / リサイクルポリエステル30%（フリース［裏起毛］）
カンガルーポケット
リブ仕上げの袖口と裾
ベター・コットン・イニシアティブ
商品番号：IL3294
色：ワンダーベージュ
生産国：Indonesia",[],4,2,100%,3.5 / 5,3.5 / 5,4.5 / 5,4 / 5,"ウェア・服, トップス, パーカー(フーディー), スウェット（トレーナー）, スポーツウェア, ベターコットン, IZA15"
https://shop.adidas.jp/products/IR9394,戻る / トップ / メンズ / ウェア・服 / トップス / ポロシャツ / オリジナルス / オリジナルス スプリングコレクション / プレミアムポロシャツ,メンズオリジナルス,プレミアムポロシャツ,"15,400","2XS, XS, S, M, L, XL, 2XL, 3XL",,"['https://shop.adidas.jp/photo/IR/IR9394/z-IR9394-on_model-standard_view-ATl9Qivttn.jpg', 'https://shop.adidas.jp/photo/IR/IR9394/z-IR9394-01-iHQ1NYDEBo.jpg', 'https://shop.adidas.jp/photo/IR/IR9394/z-IR9394-02-2x6TMBurwx.jpg', 'https://shop.adidas.jp/photo/IR/IR9394/z-IR9394-on_model-back_view-hjicGjwYjS.jpg', 'https://shop.adidas.jp/photo/IR/IR9394/z-IR9394-on_model-walking_view-IP9Qd2JQvl.jpg', 'https://shop.adidas.jp/photo/IR/IR9394/z-IR9394-3d_torso-front_center_view-XLn2m6E5yL.jpg', 'https://shop.adidas.jp/photo/IR/IR9394/z-IR9394-on_model-detail_view_1-kfJBpvMbmm.jpg', 'https://shop.adidas.jp/photo/IR/IR9394/z-IR9394-on_model-detail_view_2-kQ6FGNmas2.jpg']",リサイクルと再生可能素材を組み合わせた、スポーティーなポロシャツ。,"このポロシャツは、ピッチを離れたアスリートの雰囲気を漂わせるタウンユースのウェア。軽いジャカード織りの生地が、涼しく快適な着心地をもたらし、アディダスの伝統をさりげなく感じさせる。胸のトレフォイル刺しゅうや、袖のスリーストライプスなどのシグネチャーディテールで、スポーティーなスタイルにひねりを加えている。

リサイクル製品を選択することで、すでに製造された素材を再利用することができ、ゴミの削減につながる。また、再生可能素材を選択することも、限りある資源への依存を減らすことになる。この製品は、リサイクル素材や再生可能素材をブレンドしたものを70%以上使用している。","レギュラーフィット
ポロ襟 / ジップクロージャー
ポリエステル61% / 綿35% / ポリウレタン4% （ジャカード）
リサイクル・再生可能素材を20%以上使用
商品番号：IR9394
色：プリラブドインク",[],,,,,,,,"ウェア・服, トップス, ポロシャツ, オリジナルス, オリジナルス スプリングコレクション, 半袖, リサイクル素材と再生可能素材, KMC36"
https://shop.adidas.jp/products/IZ4920/,戻る / トップ / メンズ / ウェア・服 / ボトムス / パンツ / オリジナルス / ORDINARY PEOPLE x トラックパンツ,メンズオリジナルス,ORDINARY PEOPLE X トラックパンツ,"18,700","XS, S, M, L, XL, 2XL, 3XL",,"['https://shop.adidas.jp/photo/IZ/IZ4920/z-IZ4920-on_model-standard_view-563kp5yjuE.jpg', 'https://shop.adidas.jp/photo/IZ/IZ4920/z-IZ4920-on_model-back_view-LMFQyBpXb8.jpg', 'https://shop.adidas.jp/photo/IZ/IZ4920/z-IZ4920-on_model-walking_view-W2UVPt4xBn.jpg', 'https://shop.adidas.jp/photo/IZ/IZ4920/z-IZ4920-3d_torso-front_center_view-C5YlJOLcDX.jpg', 'https://shop.adidas.jp/photo/IZ/IZ4920/z-IZ4920-on_model-detail_view_1-zrnRhO84b4.jpg', 'https://shop.adidas.jp/photo/IZ/IZ4920/z-IZ4920-on_model-detail_view_2-mo5TGlu1yO.jpg']",韓国ブランド「ORDINARY PEOPLE」とのコラボレートコレクションが登場。,"まさしくアディダス オリジナルスらしい、軽やかなウーブンパンツだが、脚の中央のジップを開けるとスリーストライプスが覗く、斬新なデザイン。Ordinary Peopleとのコラボレーションから生まれた、どこにでもはいていけるルーズなシルエットの優秀パンツ。

この製品にはリサイクル素材を100%使用。製造された製品の素材をリユースすることで、ゴミの量、限りある資源への依存、そしてアディダス製品のフットプリントを減らすことにつながる。","ルーズフィット
ジップフライ / ボタンクロージャー
ナイロン100％（プレーンウィーブ）
両サイドにポケット
バックポケット
レッグポケット
脚のフロント中央にジップ
商品番号：IZ4920
色：オニックス
生産国：China",[],,,,,,,,"ウェア・服, ボトムス, パンツ, オリジナルス, リサイクル素材一部使用, JMN70"
https://shop.adidas.jp/products/IM9417/,戻る / トップ / メンズ / ウェア・服 / ボトムス / ショートパンツ・短パン / オリジナルス / アディカラー / アディカラー クラシック / アディカラー クラシックス スプリンターショーツ,メンズオリジナルス,アディカラー クラシックス スプリンターショーツ,"6,600","XS, S, M, L, XL, 2XL, 3XL",3.5,"['https://shop.adidas.jp/photo/IM/IM9417/z-IM9417-on_model-standard_view-LspcaY0Ssa.jpg', 'https://shop.adidas.jp/photo/IM/IM9417/z-IM9417-on_model-back_view-4JQtNH4Gm4.jpg', 'https://shop.adidas.jp/photo/IM/IM9417/z-IM9417-on_model-walking_view-Kkto8L9W7s.jpg', 'https://shop.adidas.jp/photo/IM/IM9417/z-IM9417-3d_torso-front_center_view-rsHjEzvahY.jpg', 'https://shop.adidas.jp/photo/IM/IM9417/z-IM9417-on_model-detail_view_1-NSy5RLd9rL.jpg', 'https://shop.adidas.jp/photo/IM/IM9417/z-IM9417-on_model-detail_view_2-ZMGZzmMcVQ.jpg']",リサイクル素材で作られた、快適な軽量ショーツ。,"スリーストライプスを身に着けたら、どんな志向なのかは一目瞭然。このクラシックなショーツを追加して、カジュアルワードローブをリフレッシュしよう。アーカイブアイテムに、今年らしさをプラスしたデザイン。軽くて快適なはき心地のショーツには、貴重品をしまえる3つのポケットを備えている。

プラスチックゴミ ゼロを目指すアディダスの取り組みの一つをカタチにした、100%リサイクル素材で作られたアイテム。","レギュラーフィット
ドローコードが付いた伸縮性のウエスト
リサイクルナイロン100％（平織り）
両サイドにジップポケット
背面にポケット
商品番号：IM9417
色：ワンダーホワイト
生産国：Pakistan",[],4.7,6,83%,3.3 / 5,3.3 / 5,3.8 / 5,4.3 / 5,"ウェア・服, ボトムス, ショートパンツ・短パン, オリジナルス, アディカラー, クラシックス, アディカラー クラシック, リサイクル素材一部使用, EWU37"
