Product Link,Breadcrumb(Category),Category,Product Name,Pricing,Available Size,Sense Size,Image URL,Description Title,Description,Description(Itemization),Special Function,Rating,Number of Reviews,Recommendation Rate,Fitting Rating,Length Rating,Material Rating,Comfort Rating,KWs
https://shop.adidas.jp/products/IL7131/,戻る / トップ / メンズ / ジム・トレーニング / ウェア・服 / トップス / Tシャツ / HIIT Airchill ワークアウト 半袖Tシャツ,メンズジム・トレーニング,HIIT AIRCHILL ワークアウト 半袖Tシャツ,"7,700","XS, S, M, L, XL, 2XL, 3XL",,"['https://shop.adidas.jp/photo/IL/IL7131/z-IL7131-on_model-standard_view-QKRkt0XZ6o.jpg', 'https://shop.adidas.jp/photo/IL/IL7131/z-IL7131-on_model-back_view-W9iAzrQvqN.jpg', 'https://shop.adidas.jp/photo/IL/IL7131/z-IL7131-on_model-walking_view-NqseZurZh1.jpg', 'https://shop.adidas.jp/photo/IL/IL7131/z-IL7131-3d_torso-front_center_view-kQNZ1EXzVz.jpg', 'https://shop.adidas.jp/photo/IL/IL7131/z-IL7131-on_model-detail_view_1-lxeCvZWGmo.jpg', 'https://shop.adidas.jp/photo/IL/IL7131/z-IL7131-on_model-detail_view_2-Weh0Et88F6.jpg']",リサイクル素材と再生可能素材を組み合わせた、クールなTシャツ。,"高強度のインターバルトレーニングに力を注ぐときは、HEAT. RDYテクノロジーをフィーチャーしたこのアディダスTシャツを着てほしい。身体をクールに保つAIRCHILLを採用した、エアフローを高めるデザインの一枚。軽く、通気性のよいファブリックが汗を吸収し、身体が暑くなり過ぎることなく自分の限界に挑戦できる。身体のラインにぴったり沿うアスレチックカットで仕立てたパフォーマンス重視のフィット感で、タフなトレーニングセッションにしっかり対応する。

リサイクル素材を選択することで、既に製造された製品の素材を再利用することができ、それがゴミの削減につながる。また、再生可能素材を選択することでも、限りある資源への依存を減らすことができる。このアディダス製品は、リサイクル素材や再生可能素材をブレンドしたものを70%以上使用している。","スリムフィット
クルーネック
ポリエステル63% / アセテート37%（エンジニアード）
HEAT. RDY
AIRCHILL
リフレクター付き
リサイクル・再生可能素材を70%以上使用
商品番号：IL7131
色：オーロラブラック","['https://shop.adidas.jp/fp/images/taxonomy/code/TC1465', 'ヒートレディ', '通気性・速乾性・冷却性に優れ、アスリートの衣服内環境を快適に保つadidas最高峰のクーリング機能。身体をクールに快適に保つ除熱機能がアスリートのトレーニングをサポートする。']",,,,,,,,"ウェア・服, トップス, Tシャツ, ジム・トレーニング, 半袖, ヒートレディ, リサイクル素材と再生可能素材, ジム・トレーニングウェア・服, IHP77"
https://shop.adidas.jp/products/JD6346/,戻る / トップ / メンズ / ウェア・服 / トップス / シャツ / オリジナルス / オリジナルス レジャー リーグ グラウンドキーパーシャツ,メンズオリジナルス,オリジナルス レジャー リーグ グラウンドキーパーシャツ,"6,270","XS, S, M, L, XL, 2XL, 3XL",,"['https://shop.adidas.jp/photo/JD/JD6346/z-JD6346-on_model-standard_view-NLiTkcl3yP.jpg', 'https://shop.adidas.jp/photo/JD/JD6346/z-JD6346-on_model-back_view-HkBKo5gGdj.jpg', 'https://shop.adidas.jp/photo/JD/JD6346/z-JD6346-on_model-walking_view-Qh4R4ozDyT.jpg', 'https://shop.adidas.jp/photo/JD/JD6346/z-JD6346-3d_torso-front_center_view-r5i3P13flK.jpg', 'https://shop.adidas.jp/photo/JD/JD6346/z-JD6346-on_model-detail_view_1-ON4ZihHQOZ.jpg', 'https://shop.adidas.jp/photo/JD/JD6346/z-JD6346-on_model-detail_view_2-g5gU4KMwSl.jpg']",トロピカルな雰囲気漂う、ゆったりとしたカジュアルシャツ。,"ストレスフリーな、リラックスした時間を楽しむために作られた、スタイリッシュなシャツ。コットンツイル生地を使用した、力の抜けたカジュアルな着こなしができるゆったりしたクラシックシャツ。ボタンフロントだから、前を開けてラフに着てもいい。背面のトロピカルグラフィックが、リラックスした気分にさせてくれる。

この製品に使われているコットンは、ベターコットンを通して供給されている。「マスバランス」と呼ばれる生産物流管理モデルを通じて調達されており、最終製品までの過程を物理的に辿れるわけではない。

詳細はこちら：https://bettercotton.org/who-we-are/our-logo/","ルーズフィット
ボタンフロント
綿100%（ツイル）
素材は、ベターコットンを通して、マスバランスと呼ばれるシステム経由で調達しているため、この製品にベターコットンが使用されていない可能性もあります。
商品番号：JD6346
色：ダークブルー
生産国：China",[],,,,,,,,"ウェア・服, トップス, シャツ, オリジナルス, 半袖, ベターコットン, KSF27"
https://shop.adidas.jp/products/IV5582/,戻る / トップ / メンズ / ウェア・服 / トップス / スウェット（トレーナー） / Y-3 / Y-3 FRENCH TERRY CREW SWEATER,メンズY-3,Y-3 FRENCH TERRY CREW SWEATER,"60,500","XS, S, M, L",,"['https://shop.adidas.jp/photo/IV/IV5582/z-IV5582-on_model-standard_view-xWg9XOmIkg.jpg', 'https://shop.adidas.jp/photo/IV/IV5582/z-IV5582-on_model-side_view-ktyzvxih9X.jpg', 'https://shop.adidas.jp/photo/IV/IV5582/z-IV5582-on_model-back_view-hHSCjKNIXw.jpg', 'https://shop.adidas.jp/photo/IV/IV5582/z-IV5582-on_model-walking_view-WBTW4fOF6V.jpg', 'https://shop.adidas.jp/photo/IV/IV5582/z-IV5582-flat-front_center_view-9VWiv2BvPA.jpg', 'https://shop.adidas.jp/photo/IV/IV5582/z-IV5582-on_model-detail_view_1-9RsrLY5oc1.jpg', 'https://shop.adidas.jp/photo/IV/IV5582/z-IV5582-on_model-detail_view_2-5r9IkSWyd9.jpg', 'https://shop.adidas.jp/photo/IV/IV5582/z-IV5582-on_model-detail_view_3-ECFAeHPR0W.jpg']",モダンなロゴをあしらったY-3 スウェット。,"「Y-3は、伝統と新しいものを掛け合わせることで生まれる緊張感や、スポーツとファッションの融合をコンセプトにした極めて実験的なブランドなんだ」 — 山本耀司。

Y-3の人気アイテムをフレッシュにアップデート。この「Y-3 FRENCH TERRY CREW SWEATER」は、素材にソフトなフレンチテリーコットンを使用し、カジュアルなオーバーサイズのシルエットに仕上げている。前にあしらったソフトなタッチの同系色のY-3 ロゴがアクセント。","ルーズフィット
リブ仕上げのクルーネック
綿100%（フレンチテリー［裏毛］）
ネックラインに半月型のライニング
リブ仕上げの袖口と裾
商品番号：IV5582
色：シャドーレッド",[],,,,,,,,"ウェア・服, トップス, スウェット（トレーナー）, Y-3, 長袖, JNR36"
https://shop.adidas.jp/products/IP1729/,戻る / トップ / メンズ / サッカー / ウェア・服 / トップス / ユニフォーム / クラブチーム / マンチェスター・ユナイテッド 23/24 長袖ホームユニフォーム,メンズサッカー,マンチェスター・ユナイテッド 23/24 長袖ホームユニフォーム,"14,300","XS, S, M, L, 2XL",,"['https://shop.adidas.jp/photo/IP/IP1729/z-IP1729-on_model-standard_view-0Ef7USi7uh.jpg', 'https://shop.adidas.jp/photo/IP/IP1729/z-IP1729-on_model-back_view-HALfcrLpml.jpg', 'https://shop.adidas.jp/photo/IP/IP1729/z-IP1729-on_model-walking_view-Wxyuc138aX.jpg', 'https://shop.adidas.jp/photo/IP/IP1729/z-IP1729-3d_torso-front_center_view-Dn0fI44KY9.jpg', 'https://shop.adidas.jp/photo/IP/IP1729/z-IP1729-3d_torso-back_center_view-6uhROiS0gL.jpg', 'https://shop.adidas.jp/photo/IP/IP1729/z-IP1729-on_model-detail_view_1-9nnnGVKhxi.jpg', 'https://shop.adidas.jp/photo/IP/IP1729/z-IP1729-on_model-detail_view_2-DDA1gpqk4X.jpg']",リサイクル素材で作られた、クラブと街を繫ぐサポータージャージー。,"クラブと街には共通点がある。このアディダス マンチェスター・ユナイテッドのユニフォームは、世界に大きな影響を及ぼしたマンチェスターの鋳鉄橋と、強く結びついている。デザインエレメントは、近くの産業革命時代の橋から抽出。ランカシャーローズを思わせる模様をフロントにびっしり並べている。吸湿性を発揮するAEROREADYを採用した生地にチームのウーブンエンブレムをあしらい、サポーターが誇りを持って快適にチームを応援できるデザイン。

プラスチックゴミ ゼロを目指すアディダスの取り組みの一つをカタチにした、100%リサイクル素材で作られたアイテム。","スリムフィット
リブ仕上げのクルーネック
ポリエステル100％（トリコット）
AEROREADY
脇下に通気性に優れたメッシュインサート
リブ仕上げのカフ
ドロップテールの裾
マンチェスター・ユナイテッドのウーブンエンブレム
商品番号：IP1729
色：チームカレッジレッド
生産国：Vietnam","['https://shop.adidas.jp/fp/images/taxonomy/code/TC1466', 'エアロレディ', '汗を素早く吸収・発散しドライな着心地をキープする、ソフトで吸湿性に優れた素材。']",,,,,,,,"ウェア・服, トップス, ユニフォーム, サッカー, フットサル, クラブチーム, 長袖, マンチェスター・ユナイテッド, エアロレディ, リサイクル素材一部使用, サッカーウェア・服, フットサルウェア・服, DKS66"
https://shop.adidas.jp/products/IS3736/,戻る / トップ / メンズ / ジム・トレーニング / ウェア・服 / トップス / Tシャツ / HIIT Airchill ワークアウト 半袖Tシャツ,メンズジム・トレーニング,HIIT AIRCHILL ワークアウト 半袖Tシャツ,"7,700","XS, S, M, L, XL, 2XL, 3XL",,"['https://shop.adidas.jp/photo/IS/IS3736/z-IS3736-marketing-heromrktng_view_1-ZqL4KJHgCu.jpg', 'https://shop.adidas.jp/photo/IS/IS3736/z-IS3736-on_model-standard_view-PQeTh2W2DZ.jpg', 'https://shop.adidas.jp/photo/IS/IS3736/z-IS3736-marketing-heromrktng_view_3-LsI2xqZGjr.jpg', 'https://shop.adidas.jp/photo/IS/IS3736/z-IS3736-marketing-heromrktng_view_4-HJoAg6kjhP.jpg', 'https://shop.adidas.jp/photo/IS/IS3736/z-IS3736-marketing-heromrktng_view_5-GNVoQQiWOU.jpg', 'https://shop.adidas.jp/photo/IS/IS3736/z-IS3736-marketing-heromrktng_view_6-c57bmwXIsb.jpg', 'https://shop.adidas.jp/photo/IS/IS3736/z-IS3736-marketing-heromrktng_view_7-bmBZAIS9PI.jpg', 'https://shop.adidas.jp/photo/IS/IS3736/z-IS3736-marketing-heromrktng_view_8-KxsoXXCJbQ.jpg', 'https://shop.adidas.jp/static/images/tools/itemCard_dummy.jpg', 'https://shop.adidas.jp/static/images/tools/itemCard_dummy.jpg', 'https://shop.adidas.jp/static/images/tools/itemCard_dummy.jpg', 'https://shop.adidas.jp/static/images/tools/itemCard_dummy.jpg', 'https://shop.adidas.jp/static/images/tools/itemCard_dummy.jpg', 'https://shop.adidas.jp/static/images/tools/itemCard_dummy.jpg', 'https://shop.adidas.jp/static/images/tools/itemCard_dummy.jpg']",リサイクル素材と再生可能素材を組み合わせた、クールなTシャツ。,"高強度のインターバルトレーニングに力を注ぐときは、HEAT. RDYテクノロジーをフィーチャーしたこのアディダスTシャツを着てほしい。身体をクールに保つAIRCHILLを採用した、エアフローを高めるデザインの一枚。軽く、通気性のよいファブリックが汗を吸収し、身体が暑くなり過ぎることなく自分の限界に挑戦できる。身体のラインにぴったり沿うアスレチックカットで仕立てたパフォーマンス重視のフィット感で、タフなトレーニングセッションにしっかり対応する。

リサイクル素材を選択することで、既に製造された製品の素材を再利用することができ、それがゴミの削減につながる。また、再生可能素材を選択することでも、限りある資源への依存を減らすことができる。このアディダス製品は、リサイクル素材や再生可能素材をブレンドしたものを70%以上使用している。","スリムフィット
クルーネック
ポリエステル63% / アセテート37%（エンジニアード）
HEAT. RDY
AIRCHILL
リフレクター付き
リサイクル・再生可能素材を70%以上使用
商品番号：IS3736
色：チョークホワイト","['https://shop.adidas.jp/fp/images/taxonomy/code/TC1465', 'ヒートレディ', '通気性・速乾性・冷却性に優れ、アスリートの衣服内環境を快適に保つadidas最高峰のクーリング機能。身体をクールに快適に保つ除熱機能がアスリートのトレーニングをサポートする。']",,,,,,,,"ウェア・服, トップス, Tシャツ, ジム・トレーニング, 半袖, ヒートレディ, リサイクル素材と再生可能素材, ジム・トレーニングウェア・服, IHP77"
https://shop.adidas.jp/products/JJ1218/,戻る / トップ / メンズ / ウェア・服 / トップス / Tシャツ / オリジナルス / トレフォイル トーチ Tシャツ,メンズオリジナルス,トレフォイル トーチ Tシャツ,"6,270","XS, M, XL, 2XL, 4XL, 6XL",,"['https://shop.adidas.jp/photo/JJ/JJ1218/z-JJ1218-72-ZA9nTXy6K5.jpg', 'https://shop.adidas.jp/photo/JJ/JJ1218/z-JJ1218-71-wSeTefq6am.jpg', 'https://shop.adidas.jp/photo/JJ/JJ1218/z-JJ1218-on_model-standard_view-p4jpZqtkDm.jpg', 'https://shop.adidas.jp/photo/JJ/JJ1218/z-JJ1218-on_model-back_view-SrsypQHAcg.jpg', 'https://shop.adidas.jp/photo/JJ/JJ1218/z-JJ1218-on_model-walking_view-3FF9FnOqcJ.jpg', 'https://shop.adidas.jp/photo/JJ/JJ1218/z-JJ1218-3d_torso-front_center_view-a8p5EWrThV.jpg', 'https://shop.adidas.jp/photo/JJ/JJ1218/z-JJ1218-on_model-detail_view_1-z0tW14UZ8S.jpg', 'https://shop.adidas.jp/photo/JJ/JJ1218/z-JJ1218-on_model-detail_view_2-i9Snipr0MB.jpg']",どんなアイテムにも合わせやすい、メッセージ性のあるTシャツ。,"何十年にもわたって愛されてきたアイコニックなスタイルの象徴である、トレフォイルの不朽のデザインにオマージュを捧げるTシャツが登場。無駄を省き快適さを最大限高めた作りで、ソフトなコットンを100%使用してリブ仕上げのクルーネックをあしらい仕上げている。スタイル、快適さ、文化的繋がりの代名詞的存在であるトレフォイル。

この製品に使われているコットンは、ベターコットンを通して供給されている。ベターコットンの調達は、「マスバランス」と呼ばれる生産物流管理モデルを通しているが、最終製品までの過程を物理的に辿れるわけではない。

詳細はこちら：https://bettercotton.org/who-we-are/our-logo/","レギュラーフィット
リブ仕上げのクルーネック
綿100%（シングルジャージー）
素材は、ベターコットンを通して、マスバランスと呼ばれるシステム経由で調達しているため、この製品には実際にベターコットンが使用されていない可能性があります。
商品番号：JJ1218
色：ホワイト
生産国：Pakistan",[],,,,,,,,"ウェア・服, トップス, Tシャツ, オリジナルス, 半袖, ベターコットン, KSG82"
https://shop.adidas.jp/products/IS3711/,戻る / トップ / メンズ / ジム・トレーニング / ウェア・服 / トップス / タンクトップ / HEAT.RDY / Designed for Training ワークアウト HEAT. RDYタンクトップ,メンズジム・トレーニング,DESIGNED FOR TRAINING ワークアウト HEAT. RDYタンクトップ,"4,950","XS, S, M, L, XL, 2XL, 3XL",,"['https://shop.adidas.jp/photo/IS/IS3711/z-IS3711-on_model-standard_view-ylY2rSA34v.jpg', 'https://shop.adidas.jp/photo/IS/IS3711/z-IS3711-on_model-back_view-XiJpQFjIl2.jpg', 'https://shop.adidas.jp/photo/IS/IS3711/z-IS3711-on_model-walking_view-tIK5xmE7BK.jpg', 'https://shop.adidas.jp/photo/IS/IS3711/z-IS3711-3d_torso-front_center_view-mr8RDQi3Q8.jpg', 'https://shop.adidas.jp/photo/IS/IS3711/z-IS3711-on_model-detail_view_1-F1U9VXN9iz.jpg', 'https://shop.adidas.jp/photo/IS/IS3711/z-IS3711-on_model-detail_view_2-xg63vCAyUE.jpg']",リサイクル素材で作られた、クールな感触のトレーニングタンクトップ。,"極限まで自分を追い込む高強度のワークアウトでも、このアディダスのタンクトップを着れば、クールなコンディションのまま集中力を維持できる。ワークアウトがヒートアップしても、HEAT. RDYの機能によりベンチレーションを促進し、汗を素早く逃がしてくれる。自由に動けるようにアームホールを深くして、ロープクライムでもベンチプレスでも思うがままに力を発揮できる。

この製品には、リサイクル素材を70%以上使用。製造された製品の素材をリユースすることで、ゴミの量、限りある資源への依存、そしてアディダス製品のフットプリントを減らすことにつながる。","レギュラーフィット
クルーネック
ポリエステル100%（ダブルニット）
HEAT. RDY
大きめのアームホール
裾にサイドスリット
商品番号：IS3711
色：シャドーバイオレット","['https://shop.adidas.jp/fp/images/taxonomy/code/TC1465', 'ヒートレディ', '通気性・速乾性・冷却性に優れ、アスリートの衣服内環境を快適に保つadidas最高峰のクーリング機能。身体をクールに快適に保つ除熱機能がアスリートのトレーニングをサポートする。']",3,1,100%,4 / 5,4 / 5,4 / 5,3 / 5,"ウェア・服, トップス, タンクトップ, ジム・トレーニング, HEAT.RDY, ノースリーブ, ヒートレディ, リサイクル素材一部使用, ジム・トレーニングウェア・服, IHP83"
https://shop.adidas.jp/products/IV5585,戻る / トップ / メンズ / ウェア・服 / トップス / パーカー(フーディー) / Y-3 / Y-3 FRENCH TERRY HOODIE,メンズY-3,Y-3 FRENCH TERRY HOODIE,"60,500","XS, S, M, L, XL",,"['https://shop.adidas.jp/photo/IV/IV5585/z-IV5585-on_model-standard_view-E0iJDmYKnu.jpg', 'https://shop.adidas.jp/photo/IV/IV5585/z-IV5585-on_model-side_view-YixeCh7BB6.jpg', 'https://shop.adidas.jp/photo/IV/IV5585/z-IV5585-on_model-back_view-9pc6SbUnIG.jpg', 'https://shop.adidas.jp/photo/IV/IV5585/z-IV5585-on_model-walking_view-DqIYiElDEG.jpg', 'https://shop.adidas.jp/photo/IV/IV5585/z-IV5585-flat-front_center_view-2vBh9sTr61.jpg', 'https://shop.adidas.jp/photo/IV/IV5585/z-IV5585-on_model-detail_view_1-p60r8x5B9X.jpg', 'https://shop.adidas.jp/photo/IV/IV5585/z-IV5585-on_model-detail_view_2-PQzDebSACA.jpg', 'https://shop.adidas.jp/photo/IV/IV5585/z-IV5585-on_model-detail_view_3-Qcgb4tLIw9.jpg']",ルーズフィットのY-3パーカー。,シンプルさを讃えてデザインされたこの「Y-3 FRENCH TERRY HOODIE」は、素材にソフトなコットンフレンチテリーを使用した、カジュアルなルーズフィットの作り。ドローコードの付いたフードとカンガルーポケットを備えた、毎日でも着たくなるアイテム。,"ルーズフィット
ドローコードで調節可能なフードを備えたプルオーバー
綿80% / ポリエステル20%（フレンチテリー［裏毛］）
カンガルーポケットと内側に携帯電話用ポケット
リブ仕上げの袖口と裾
Y-3 ロゴ
商品番号：IV5585
色：アシッドミント",[],,,,,,,,"ウェア・服, トップス, パーカー(フーディー), スウェット（トレーナー）, Y-3, JNR37"
https://shop.adidas.jp/products/IT9047/,戻る / トップ / メンズ / サッカー / ウェア・服 / ボトムス / パンツ / クラブチーム / マンチェスター・ユナイテッド LFSTLR ウーブンパンツ,メンズサッカー,マンチェスター・ユナイテッド LFSTLR ウーブンパンツ,"12,100","XS, S, M, L, XL, 2XL, 3XL",,"['https://shop.adidas.jp/photo/IT/IT9047/z-IT9047-on_model-standard_view-lUZQzRLcuP.jpg', 'https://shop.adidas.jp/photo/IT/IT9047/z-IT9047-on_model-side_view-AKaKTmDI39.jpg', 'https://shop.adidas.jp/photo/IT/IT9047/z-IT9047-on_model-back_view-GpeQGFGvFI.jpg', 'https://shop.adidas.jp/photo/IT/IT9047/z-IT9047-on_model-walking_view-yZGKiGOY4z.jpg', 'https://shop.adidas.jp/photo/IT/IT9047/z-IT9047-3d_torso-front_center_view-lIH06aA1ls.jpg', 'https://shop.adidas.jp/photo/IT/IT9047/z-IT9047-on_model-detail_view_1-qLUS044iI4.jpg', 'https://shop.adidas.jp/photo/IT/IT9047/z-IT9047-on_model-detail_view_2-REBhOucHMF.jpg', 'https://shop.adidas.jp/static/images/tools/itemCard_dummy.jpg']",リサイクル素材を使用した、オフタイムもマンUをサポートできるルーズパンツ。,"思い切り寛ぐときも大胆に自己主張しよう。片脚に赤い悪魔のエンブレムをあしらった、アディダスのサッカースウェットパンツ。マンチェスター・ユナイテッドのミニマルなサードキットのデザインをヒントにしている。リラックスしたいときに活躍する、滑らかなプレーンウィーブファブリックを使用したルーズフィットの作り。汗を素早く吸収するAEROREADYテクノロジーを採用した、ギアを上げて過ごす日にぴったりの一着。

この製品にはリサイクル素材を100%使用。製造された製品の素材をリユースすることで、ゴミの量、限りある資源への依存、そしてアディダス製品のフットプリントを減らすことにつながる。","ルーズフィット
ドローコード付きの伸縮性ウエスト
ポリエステル100%（プレーンウィーブ）
AEROREADY
フロントポケット
ストレートレッグ
伸縮性のあるカフ
マンチェスター・ユナイテッドのウーブンエンブレム
商品番号：IT9047
色：チームカレッジバーガンディ
生産国：Vietnam","['https://shop.adidas.jp/fp/images/taxonomy/code/TC1466', 'エアロレディ', '汗を素早く吸収・発散しドライな着心地をキープする、ソフトで吸湿性に優れた素材。']",,,,,,,,"ウェア・服, ボトムス, パンツ, サッカー, フットサル, クラブチーム, マンチェスター・ユナイテッド, エアロレディ, リサイクル素材一部使用, サッカーウェア・服, フットサルウェア・服, DKU84"
https://shop.adidas.jp/products/JJ1219/,戻る / トップ / メンズ / ウェア・服 / トップス / Tシャツ / オリジナルス / トレフォイル トーチ Tシャツ,メンズオリジナルス,トレフォイル トーチ Tシャツ,"6,270","XS, M, XL, 2XL, 4XL, 6XL",,"['https://shop.adidas.jp/photo/JJ/JJ1219/z-JJ1219-on_model-standard_view-8wOloVnR9H.jpg', 'https://shop.adidas.jp/photo/JJ/JJ1219/z-JJ1219-on_model-back_view-iaunCLJZGm.jpg', 'https://shop.adidas.jp/photo/JJ/JJ1219/z-JJ1219-on_model-walking_view-1qptfltUmb.jpg', 'https://shop.adidas.jp/photo/JJ/JJ1219/z-JJ1219-3d_torso-front_center_view-VQ6k75OKB9.jpg', 'https://shop.adidas.jp/photo/JJ/JJ1219/z-JJ1219-on_model-detail_view_1-8xTgWcV0Gl.jpg', 'https://shop.adidas.jp/photo/JJ/JJ1219/z-JJ1219-on_model-detail_view_2-3inGLgA9hL.jpg']",どんなアイテムにも合わせやすい、メッセージ性のあるTシャツ。,"何十年にもわたって愛されてきたアイコニックなスタイルの象徴である、トレフォイルの不朽のデザインにオマージュを捧げるTシャツが登場。無駄を省き快適さを最大限高めた作りで、ソフトなコットンを100%使用してリブ仕上げのクルーネックをあしらい仕上げている。スタイル、快適さ、文化的繋がりの代名詞的存在であるトレフォイル。

この製品に使われているコットンは、ベターコットンを通して供給されている。ベターコットンの調達は、「マスバランス」と呼ばれる生産物流管理モデルを通しているが、最終製品までの過程を物理的に辿れるわけではない。

詳細はこちら：https://bettercotton.org/who-we-are/our-logo/","レギュラーフィット
リブ仕上げのクルーネック
綿100%（シングルジャージー）
素材は、ベターコットンを通して、マスバランスと呼ばれるシステム経由で調達しているため、この製品には実際にベターコットンが使用されていない可能性があります。
商品番号：JJ1219
色：ベタースカーレット
生産国：Pakistan",[],,,,,,,,"ウェア・服, トップス, Tシャツ, オリジナルス, 半袖, ベターコットン, KSG82"
