Product Link,Breadcrumb(Category),Category,Product Name,Pricing,Available Size,Sense Size,Image URL,Description Title,Description,Description(Itemization),Special Function,Rating,Number of Reviews,Recommendation Rate,Fitting Rating,Length Rating,Material Rating,Comfort Rating,KWs
https://shop.adidas.jp/products/IT1932,戻る / トップ / メンズ / ウェア・服 / ボトムス / タイツ・レギンス / オリジナルス / Fear of God Athletics / Fear of God Athletics ランニングレギンス,メンズオリジナルス,FEAR OF GOD ATHLETICS ランニングレギンス,"27,500",,,"['https://shop.adidas.jp/photo/IT/IT1932/z-IT1932-flat-front_center_view-WfYOvKGExI.jpg', 'https://shop.adidas.jp/photo/IT/IT1932/z-IT1932-on_model-heromrktng_view_1-5ejCcLYdym.jpg', 'https://shop.adidas.jp/photo/IT/IT1932/z-IT1932-on_model-heromrktng_view_3-9vc5SZYzQg.jpg', 'https://shop.adidas.jp/photo/IT/IT1932/z-IT1932-on_model-heromrktng_view_5-601L4xS6G7.jpg', 'https://shop.adidas.jp/photo/IT/IT1932/z-IT1932-on_model-heromrktng_view_6-n0NwHXpAuM.jpg', 'https://shop.adidas.jp/photo/IT/IT1932/z-IT1932-on_model-heromrktng_view_7-UHgkHifGpn.jpg', 'https://shop.adidas.jp/photo/IT/IT1932/z-IT1932-flat-back_center_view-mF4bzfQf52.jpg', 'https://shop.adidas.jp/photo/IT/IT1932/z-IT1932-flat-detail_view_1-uD0jr3fTIY.jpg', 'https://shop.adidas.jp/static/images/tools/itemCard_dummy.jpg', 'https://shop.adidas.jp/static/images/tools/itemCard_dummy.jpg']",FEAR OF GOD ATHLETICS コレクションから生まれた、ランニングレギンス。,高機能ストレッチファブリックを使用し、着圧感と動きやすさをちょうどいいバランスで両立させた、Fear of God Athleticsのレギンスが登場。ボンデッドシームと、レーザーでカットした縁など、機能的なディテールが随所に施されている。ウエストバンドのフロント中央にあしらった、スエード調ブラックバーラベルがアクセント。,"タイトフィット
ハイライズのウエスト
フルレングス
ナイロン64% / ポリウレタン36%（インターロック）
ボンデッドシーム
レーザーでカットした切りっぱなしの縁
ウエストバンドのフロント中央にスエード調ブラックバーラベル
商品番号：IT1932
色：ブラック",[],,,,,,,,"ウェア・服, ボトムス, タイツ・レギンス, オリジナルス, バスケットボール, FEAR OF GOD ATHLETICS, リサイクル素材, バスケットボールウェア・服, JTU62"
https://shop.adidas.jp/products/IP8245/,戻る / トップ / メンズ / サッカー / ウェア・服 / トップス / ユニフォーム / 代表 / ドイツ代表 ティロ 24 コンペティション トレーニングジャージー,メンズサッカー,ドイツ代表 ティロ 24 コンペティション トレーニングジャージー,"6,600","S, M, L, XL, 2XL, 3XL",,"['https://shop.adidas.jp/photo/IP/IP8245/z-IP8245-on_model-standard_view-iN1hZ6csDI.jpg', 'https://shop.adidas.jp/photo/IP/IP8245/z-IP8245-on_model-back_view-IvdkKKqQhN.jpg', 'https://shop.adidas.jp/photo/IP/IP8245/z-IP8245-on_model-walking_view-fMNhTilyfR.jpg', 'https://shop.adidas.jp/photo/IP/IP8245/z-IP8245-3d_torso-front_center_view-Z8LSf2LIKo.jpg', 'https://shop.adidas.jp/photo/IP/IP8245/z-IP8245-3d_torso-back_center_view-izpyRPcN3l.jpg', 'https://shop.adidas.jp/photo/IP/IP8245/z-IP8245-on_model-detail_view_1-wFf0NipKpz.jpg', 'https://shop.adidas.jp/photo/IP/IP8245/z-IP8245-on_model-detail_view_2-qKz36FjZAK.jpg']",リサイクル素材で作られたドイツ代表ジャージーを着て、トレーニングに励もう。,"このドイツ代表サッカージャージーを着て、ハードなトレーニングに励み、スキルを磨こう。伸縮性に優れた無駄のないすっきりしたデザインだから、気を散らすことなく自分の限界に挑戦できる。ハードなトレーニングが終わるまで、快適でドライな着心地を保つAEROREADYシリーズ。サポーターのプライドを示せるエンブレムは、胸に熱転写することで軽量化を図っている。

この製品にはリサイクル素材を100%使用。製造された製品の素材をリユースすることは、ゴミの量、限りある資源への依存、そしてアディダス製品のフットプリントを減らすことにつながる。","スリムフィット
リブ仕上げのクルーネック
ポリエステル100%（インターロック）
AEROREADY
サイド、袖、肩にメッシュインサート
ドイツ代表のエンブレムを熱転写
商品番号：IP8245
色：チームカレッジパープル
生産国：Vietnam","['https://shop.adidas.jp/fp/images/taxonomy/code/TC1466', 'エアロレディ', '汗を素早く吸収・発散しドライな着心地をキープする、ソフトで吸湿性に優れた素材。']",,,,,,,,"ウェア・服, トップス, ユニフォーム, サッカー, フットサル, 代表, ティロ, 半袖, ドイツ代表, エアロレディ, リサイクル素材一部使用, サッカーウェア・服, フットサルウェア・服, GZN70"
https://shop.adidas.jp/products/IT0911/,戻る / トップ / メンズ / ウェア・服 / トップス / Tシャツ / スポーツウェア / M OCEAN Tシャツ,メンズスポーツウェア,M OCEAN Tシャツ,"3,630","XS, S, M, L, XL, 2XL, 3XL",,"['https://shop.adidas.jp/photo/IT/IT0911/z-IT0911-on_model-standard_view-fnUgH9zz9W.jpg', 'https://shop.adidas.jp/photo/IT/IT0911/z-IT0911-on_model-back_view-VnTSWn3eiG.jpg', 'https://shop.adidas.jp/photo/IT/IT0911/z-IT0911-on_model-walking_view-ahdtUKbv3X.jpg', 'https://shop.adidas.jp/photo/IT/IT0911/z-IT0911-3d_torso-front_center_view-Lws5wI5xId.jpg', 'https://shop.adidas.jp/photo/IT/IT0911/z-IT0911-on_model-detail_view_1-2bIE7DbrZY.jpg', 'https://shop.adidas.jp/photo/IT/IT0911/z-IT0911-on_model-detail_view_2-LS8PCM90Mj.jpg']",,,,[],,,,,,,,"ウェア・服, トップス, Tシャツ, スポーツウェア, 半袖, ベターコットン, KUE42"
https://shop.adidas.jp/products/IT3712/,戻る / トップ / メンズ / ウェア・服 / トップス / ポロシャツ / Y-3 / クラブチーム / Y-3 REAL MADRID TRAVEL LONG SLEEVE POLO SHIRT,メンズY-3,Y-3 REAL MADRID TRAVEL LONG SLEEVE POLO SHIRT,"60,500","XS, S, M, L, XL",,"['https://shop.adidas.jp/photo/IT/IT3712/z-IT3712-marketing-heromrktng_view_1-ABKq6copqo.jpg', 'https://shop.adidas.jp/photo/IT/IT3712/z-IT3712-on_model-standard_view-DJq3irOAdX.jpg', 'https://shop.adidas.jp/photo/IT/IT3712/z-IT3712-marketing-heromrktng_view_3-4FO6Ez50yV.jpg', 'https://shop.adidas.jp/photo/IT/IT3712/z-IT3712-marketing-heromrktng_view_4-2jjKrHmjfq.jpg', 'https://shop.adidas.jp/photo/IT/IT3712/z-IT3712-marketing-heromrktng_view_5-74R8uojsrs.jpg', 'https://shop.adidas.jp/photo/IT/IT3712/z-IT3712-marketing-heromrktng_view_6-jx5ckw1M7d.jpg', 'https://shop.adidas.jp/photo/IT/IT3712/z-IT3712-marketing-heromrktng_view_7-mGsYu8jYCu.jpg', 'https://shop.adidas.jp/photo/IT/IT3712/z-IT3712-marketing-heromrktng_view_8-TNfXUhNQVp.jpg', 'https://shop.adidas.jp/static/images/tools/itemCard_dummy.jpg', 'https://shop.adidas.jp/static/images/tools/itemCard_dummy.jpg', 'https://shop.adidas.jp/static/images/tools/itemCard_dummy.jpg', 'https://shop.adidas.jp/static/images/tools/itemCard_dummy.jpg', 'https://shop.adidas.jp/static/images/tools/itemCard_dummy.jpg', 'https://shop.adidas.jp/static/images/tools/itemCard_dummy.jpg', 'https://shop.adidas.jp/static/images/tools/itemCard_dummy.jpg', 'https://shop.adidas.jp/static/images/tools/itemCard_dummy.jpg']",レアル・マドリードへのオマージュを込めたY-3 ポロシャツ。,レアル・マドリードとY-3のコラボレーションから生まれた、新たな4th キット、「Y-3 REAL MADRID TRAVEL LONG SLEEVE POLO SHIRT」。エレガンス、偉大さ、伝統とファッション。両者のルーツからインスピレーションを得て、ポロ襟を付け、プレッピースタイルに仕上げたデザイン。コットン100%のインターロックファブリックを使用し、先細の袖の手首部分をリブ編みにしている。,"レギュラーフィット
ポロ襟
綿100%（インターロック）
リブ仕上げのカフ
レアル・マドリードとY-3のロゴ
商品番号：IT3712
色：ブラック",[],,,,,,,,"ウェア・服, トップス, ポロシャツ, Y-3, クラブチーム, 長袖, レアル・マドリード, ジュード・ベリンガム, JRU90"
https://shop.adidas.jp/products/IW1489,戻る / トップ / メンズ / ウェア・服 / ボトムス / タイツ・レギンス / オリジナルス / Fear of God Athletics / Fear of God Athletics ランニングレギンス,メンズオリジナルス,FEAR OF GOD ATHLETICS ランニングレギンス,"27,500",,,"['https://shop.adidas.jp/photo/IW/IW1489/z-IW1489-flat-front_center_view-bDJNEDmMOi.jpg', 'https://shop.adidas.jp/photo/IW/IW1489/z-IW1489-on_model-heromrktng_view_1-ekaSHEY8EN.jpg', 'https://shop.adidas.jp/photo/IW/IW1489/z-IW1489-on_model-heromrktng_view_3-1f1cs1sJ3m.jpg', 'https://shop.adidas.jp/photo/IW/IW1489/z-IW1489-on_model-heromrktng_view_5-OOfOmYANPT.jpg', 'https://shop.adidas.jp/photo/IW/IW1489/z-IW1489-on_model-heromrktng_view_6-6TNOlusOwH.jpg', 'https://shop.adidas.jp/photo/IW/IW1489/z-IW1489-on_model-heromrktng_view_7-swG2SwSjbK.jpg', 'https://shop.adidas.jp/photo/IW/IW1489/z-IW1489-flat-back_center_view-h2pTk8v5z7.jpg', 'https://shop.adidas.jp/photo/IW/IW1489/z-IW1489-flat-detail_view_1-eO8WSbSYVi.jpg', 'https://shop.adidas.jp/static/images/tools/itemCard_dummy.jpg', 'https://shop.adidas.jp/static/images/tools/itemCard_dummy.jpg']",FEAR OF GOD ATHLETICS コレクションから生まれた、ランニングレギンス。,高機能ストレッチファブリックを使用し、着圧感と動きやすさをちょうどいいバランスで両立させた、Fear of God Athleticsのレギンスが登場。ボンデッドシームと、レーザーでカットした縁など、機能的なディテールが随所に施されている。ウエストバンドのフロント中央にあしらった、スエード調ブラックバーラベルがアクセント。,"タイトフィット
ハイライズのウエスト
フルレングス
ナイロン64% / ポリウレタン36%（インターロック）
ボンデッドシーム
レーザーでカットした切りっぱなしの縁
ウエストバンドのフロント中央にスエード調ブラックバーラベル
商品番号：IW1489
色：クレイ",[],,,,,,,,"ウェア・服, ボトムス, タイツ・レギンス, オリジナルス, バスケットボール, FEAR OF GOD ATHLETICS, リサイクル素材, バスケットボールウェア・服, JTU62"
https://shop.adidas.jp/products/IP8359/,戻る / トップ / ユニセックス / サッカー / ウェア・服 / トップス / ユニフォーム / 代表 / スコットランド代表 24 ホームユニフォーム,サッカー,スコットランド代表 24 ホームユニフォーム,"13,200","XS, M, XL, 2XL",,"['https://shop.adidas.jp/photo/IP/IP8359/z-IP8359-on_model-standard_view-AMUwjLgvlr.jpg', 'https://shop.adidas.jp/photo/IP/IP8359/z-IP8359-on_model-back_view-Q6mXKbROc1.jpg', 'https://shop.adidas.jp/photo/IP/IP8359/z-IP8359-on_model-walking_view-bCK1u1D4FL.jpg', 'https://shop.adidas.jp/photo/IP/IP8359/z-IP8359-3d_torso-front_center_view-lzNWlL9pWE.jpg', 'https://shop.adidas.jp/photo/IP/IP8359/z-IP8359-3d_torso-back_center_view-FaiEKqgzFZ.jpg', 'https://shop.adidas.jp/photo/IP/IP8359/z-IP8359-on_model-detail_view_1-qVokpHVdeb.jpg', 'https://shop.adidas.jp/photo/IP/IP8359/z-IP8359-on_model-detail_view_2-ZAHUzNJK6e.jpg']",リサイクル素材で作られた、クラシックなタータンチェックをモダンにアレンジしたホームユニフォーム。,"タータンチェックが主役の、アイキャッチーなスコットランド代表ホームユニフォーム。トラディショナルなスコティッシュスタイルに独特のひねりを加えたデザイン。シャツの前後に大胆なグラフィックをあしらい、チームエンブレムとスタイリッシュな国旗が誇り高きプライドを掲げている。吸湿性に優れたAEROREADY素材とメッシュインサートを組み合わせた、プレーヤーとサポーターのどちらにも適した一着。

この製品にはリサイクル素材を100%使用。製造された製品の素材をリユースすることは、ゴミの量、限りある資源への依存、そしてアディダス製品のフットプリントを減らすことにつながる。","スリムフィット
リブ仕上げのクルーネック
ポリエステル100%（ジャカード）
両サイドと背面下部：ポリエステル100%（ワッフル）
AEROREADY
サイドにメッシュインサート
スコットランド代表ウーブンエンブレム
後ろ襟の下にスコットランド国旗
商品番号：IP8359
色：ナイトネイビー","['https://shop.adidas.jp/fp/images/taxonomy/code/TC1466', 'エアロレディ', '汗を素早く吸収・発散しドライな着心地をキープする、ソフトで吸湿性に優れた素材。']",,,,,,,,"ウェア・服, トップス, ユニフォーム, サッカー, フットサル, 代表, 半袖, エアロレディ, リサイクル素材一部使用, サッカーウェア・服, フットサルウェア・服, IQF47"
https://shop.adidas.jp/products/IT0912/,戻る / トップ / メンズ / ウェア・服 / トップス / Tシャツ / スポーツウェア / M OCEAN Tシャツ,メンズスポーツウェア,M OCEAN Tシャツ,"3,630","XS, S, M, L, XL, 2XL, 3XL",,"['https://shop.adidas.jp/photo/IT/IT0912/z-IT0912-on_model-standard_view-vdMcGqFHZK.jpg', 'https://shop.adidas.jp/photo/IT/IT0912/z-IT0912-on_model-back_view-N5RXQrITOj.jpg', 'https://shop.adidas.jp/photo/IT/IT0912/z-IT0912-on_model-walking_view-DVTZIu9Thm.jpg', 'https://shop.adidas.jp/photo/IT/IT0912/z-IT0912-3d_torso-front_center_view-ruIE6hilyY.jpg', 'https://shop.adidas.jp/photo/IT/IT0912/z-IT0912-on_model-detail_view_1-FNqXJN9rR5.jpg', 'https://shop.adidas.jp/photo/IT/IT0912/z-IT0912-on_model-detail_view_2-HuwWOZV91N.jpg']",,,,[],,,,,,,,"ウェア・服, トップス, Tシャツ, スポーツウェア, 半袖, ベターコットン, KUE42"
https://shop.adidas.jp/products/IN1103/,戻る / トップ / ユニセックス / サッカー / ウェア・服 / トップス / ユニフォーム / 代表 / スウェーデン代表 24 ホームユニフォーム,サッカー,スウェーデン代表 24 ホームユニフォーム,"15,400","XS, M, XL, 2XL",,"['https://shop.adidas.jp/photo/IN/IN1103/z-IN1103-on_model-standard_view-NnMZfVIYTt.jpg', 'https://shop.adidas.jp/photo/IN/IN1103/z-IN1103-on_model-back_view-4TW4aTbuR4.jpg', 'https://shop.adidas.jp/photo/IN/IN1103/z-IN1103-on_model-walking_view-gWaoN0lwYd.jpg', 'https://shop.adidas.jp/photo/IN/IN1103/z-IN1103-3d_torso-front_center_view-rCfOL8kT5U.jpg', 'https://shop.adidas.jp/photo/IN/IN1103/z-IN1103-3d_torso-back_center_view-omUP9gBRvF.jpg', 'https://shop.adidas.jp/photo/IN/IN1103/z-IN1103-on_model-detail_view_1-PobpGNOesO.jpg', 'https://shop.adidas.jp/photo/IN/IN1103/z-IN1103-on_model-detail_view_2-z7BuSaosg2.jpg']",リサイクル素材で作られた、伝統を纏ったスウェーデン代表ホームユニフォーム。,"明るく競技場で輝きながら。鮮やかなイエローのベースカラーとエンボス加工のディテールが眩しい、スウェーデン代表ホームユニフォームは、真夏の輝かしい空からインスピレーションを得てデザインされた。吸湿性を発揮するAEROREADYと通気性を高めるメッシュインサートを組み合わせた、スタンドでもピッチでも快適に着られる作り。胸のウーブンチームエンブレムが、熱狂的なサッカーファンにスポットライトを当てる。

この製品にはリサイクル素材を100%使用。製造された製品の素材をリユースすることは、ゴミの量、限りある資源への依存、そしてアディダス製品のフットプリントを減らすことにつながる。","スリムフィット
Vネック
ポリエステル100%（インターロック）
両サイドと背面下部：ポリエステル100%（ワッフル）
AEROREADY
サイドと袖にメッシュインサート
スウェーデン代表のウーブンエンブレム
後ろ襟の下に""Sverige""の文字
商品番号：IN1103
色：ブライトイエロー","['https://shop.adidas.jp/fp/images/taxonomy/code/TC1466', 'エアロレディ', '汗を素早く吸収・発散しドライな着心地をキープする、ソフトで吸湿性に優れた素材。']",,,,,,,,"ウェア・服, トップス, ユニフォーム, サッカー, フットサル, 代表, 半袖, スウェーデン代表, エアロレディ, リサイクル素材一部使用, サッカーウェア・服, フットサルウェア・服, JTS19"
https://shop.adidas.jp/products/IQ0769/,戻る / トップ / ユニセックス / サッカー / ウェア・服 / トップス / ユニフォーム / 代表 / ベルギー代表 24 ホームユニフォーム,サッカー,ベルギー代表 24 ホームユニフォーム,"13,200","XS, M, XL, 2XL",,"['https://shop.adidas.jp/photo/IQ/IQ0769/z-IQ0769-on_model-standard_view-pmqHvMQYcH.jpg', 'https://shop.adidas.jp/photo/IQ/IQ0769/z-IQ0769-on_model-back_view-w9ia27qCq4.jpg', 'https://shop.adidas.jp/photo/IQ/IQ0769/z-IQ0769-on_model-walking_view-7hhGIpJUYV.jpg', 'https://shop.adidas.jp/photo/IQ/IQ0769/z-IQ0769-3d_torso-front_center_view-EJxU8UNcaM.jpg', 'https://shop.adidas.jp/photo/IQ/IQ0769/z-IQ0769-3d_torso-back_center_view-790m6gidUd.jpg', 'https://shop.adidas.jp/photo/IQ/IQ0769/z-IQ0769-on_model-detail_view_1-AvC85UjQrd.jpg', 'https://shop.adidas.jp/photo/IQ/IQ0769/z-IQ0769-on_model-detail_view_2-Lnc4ATme1S.jpg']",リサイクル素材で作られた、スタイリッシュなベルギー代表ユニフォーム。,"視線をとらえるデザイン。このホームユニフォームの目を引く幾何学模様は、ベルギーの現代ファッションとモダンな建築からインスピレーションを得たもの。そんなグラフィックの背後では、AEROREADY素材がスタンドから代表チームを応援するサポーターの身体をドライに保ってくれる。胸のチームエンブレムと後ろ襟の""1895""のサインオフが、シーズンを通してサッカーファンの情熱を表現。

この製品にはリサイクル素材を100%使用。製造された製品の素材をリユースすることは、ゴミの量、限りある資源への依存、そしてアディダス製品のフットプリントを減らすことにつながる。","スリムフィット
リブ仕上げのVネック
ポリエステル100%（インターロック）
両サイドと背面下部：ポリエステル100%（ワッフル）
AEROREADY
サイドと袖にメッシュインサート
ベルギー代表のウーブンエンブレム
後ろ襟の下に""1895""の文字
商品番号：IQ0769
色：チームカレッジバーガンディ","['https://shop.adidas.jp/fp/images/taxonomy/code/TC1466', 'エアロレディ', '汗を素早く吸収・発散しドライな着心地をキープする、ソフトで吸湿性に優れた素材。']",,,,,,,,"ウェア・服, トップス, ユニフォーム, サッカー, フットサル, 代表, 半袖, ベルギー代表, エアロレディ, リサイクル素材一部使用, サッカーウェア・服, フットサルウェア・服, IXF08"
https://shop.adidas.jp/products/IT3715/,戻る / トップ / メンズ / ウェア・服 / ボトムス / パンツ / Y-3 / クラブチーム / Y-3 REAL MADRID TRAVEL PANTS,メンズY-3,Y-3 REAL MADRID TRAVEL PANTS,"60,500","XS, S, M, L, XL",,"['https://shop.adidas.jp/photo/IT/IT3715/z-IT3715-marketing-heromrktng_view_1-ldL21G4zx9.jpg', 'https://shop.adidas.jp/photo/IT/IT3715/z-IT3715-on_model-standard_view-q5Pl0YX5He.jpg', 'https://shop.adidas.jp/photo/IT/IT3715/z-IT3715-marketing-heromrktng_view_3-MP5HgI4mtF.jpg', 'https://shop.adidas.jp/photo/IT/IT3715/z-IT3715-marketing-heromrktng_view_4-bWxnUwB5qs.jpg', 'https://shop.adidas.jp/photo/IT/IT3715/z-IT3715-marketing-heromrktng_view_5-fROd4A14w2.jpg', 'https://shop.adidas.jp/photo/IT/IT3715/z-IT3715-marketing-heromrktng_view_6-66OS7We52s.jpg', 'https://shop.adidas.jp/photo/IT/IT3715/z-IT3715-marketing-heromrktng_view_7-y8sBwTMj0M.jpg', 'https://shop.adidas.jp/photo/IT/IT3715/z-IT3715-marketing-heromrktng_view_8-6E57sjn4cA.jpg', 'https://shop.adidas.jp/static/images/tools/itemCard_dummy.jpg', 'https://shop.adidas.jp/static/images/tools/itemCard_dummy.jpg', 'https://shop.adidas.jp/static/images/tools/itemCard_dummy.jpg', 'https://shop.adidas.jp/static/images/tools/itemCard_dummy.jpg', 'https://shop.adidas.jp/static/images/tools/itemCard_dummy.jpg', 'https://shop.adidas.jp/static/images/tools/itemCard_dummy.jpg', 'https://shop.adidas.jp/static/images/tools/itemCard_dummy.jpg', 'https://shop.adidas.jp/static/images/tools/itemCard_dummy.jpg', 'https://shop.adidas.jp/static/images/tools/itemCard_dummy.jpg']",レアル・マドリードの誇りを纏った、Y-3カフパンツ。,ファッションとスポーツを融合させた、Y-3とレアル・マドリードのコラボレーションから生まれたのが、クラブのアウェイキットをベースにした「Y-3 REAL MADRID TRAVEL PANTS」。リサイクルツイル生地を用いたパンツに、サイドとバックにポケットとベルトループを付け、ジップフライにすることで、かっちりしたテーラードパンツのような魅力が加わった。エフォートレスにエレガンスと快適さを融合させた、Yohji Yamamoto'らしいスタイル。,"レギュラーフィット
ジップフライ / ドローコード付きウエストにボタンクロージャー
ポリエステル100%（ツイル）
サイドポケットとバックポケット
リブ仕上げのカフ
ベルト通し
スポーツユニフォームらしいファブリック
レアル・マドリードとY-3のロゴ
商品番号：IT3715
色：ブラック",[],,,,,,,,"ウェア・服, ボトムス, パンツ, Y-3, クラブチーム, レアル・マドリード, ジュード・ベリンガム, JRU93"
https://shop.adidas.jp/products/HT2073/,戻る / トップ / メンズ / 水泳 / ウェア・服 / 水着 / スイムパンツ / スリー ストライプス / クラシック スリーストライプス スイムボクサー,メンズ水泳,クラシック スリーストライプス スイムボクサー,"5,170","S, M, L, XL, 2XL, 3XL",,"['https://shop.adidas.jp/photo/HT/HT2073/z-HT2073-on_model-standard_view-dNiif6ZfXE.jpg', 'https://shop.adidas.jp/photo/HT/HT2073/z-HT2073-on_model-back_view-JSQXRuvSus.jpg', 'https://shop.adidas.jp/photo/HT/HT2073/z-HT2073-on_model-walking_view-TLXD6Umwrc.jpg', 'https://shop.adidas.jp/photo/HT/HT2073/z-HT2073-3d_torso-front_center_view-GGVwtU9Y8P.jpg', 'https://shop.adidas.jp/photo/HT/HT2073/z-HT2073-3d_torso-back_view-v2rajSahqe.jpg', 'https://shop.adidas.jp/photo/HT/HT2073/z-HT2073-on_model-detail_view_1-voxE3sycds.jpg', 'https://shop.adidas.jp/photo/HT/HT2073/z-HT2073-on_model-detail_view_2-bSDVthUvyA.jpg']",リサイクル素材を一部使用した、ヘリテージスタイルのスイムボクサー。,誰でも水が好き。冷たくて、爽やかで、リラックスできて、良い要素ばかり。このアディダス スイムボクサーをはいて、ラップスイミングやリバーフロート、力強いパドリングを楽しもう。塩素に強いソフトな生地が、水中での自由な動きを妨げない。アディダスのパフォーマンスルーツを継承する、スリーストライプスをあしらっている。,"タイトフィット
内側にドローコードが付いた伸縮性ウエスト
ナイロン78％ / ポリウレタン22％（トリコット）
ジャージーの裏地
塩素に耐性のあるInfinitex Fitness Eco素材
柔らかな素材
商品番号：HT2073
色：ブラック/ホワイト",[],,,,,,,,"ウェア・服, 水着, スイムパンツ, 水泳, スリー ストライプス, インフィニテックス, リサイクル素材一部使用, 水泳ウェア・服, MKD87"
